{
  "@context": "https://openvex.dev/ns/v0.2.0",
  "@id": "https://github.com/SecPal/.github/blob/main/vex/api-66a22aa3-CVE-2023-45853-arm64.openvex.json",
  "author": "https://github.com/aroviqen",
  "timestamp": "2026-10-26T09:37:35Z",
  "version": 1,
  "statements": [
    {
      "vulnerability": {
        "name": "CVE-2023-45853"
      },
      "products": [
        {
          "identifiers": {
            "purl": "pkg:deb/debian/zlib1g@1.2.13.dfsg-1?arch=arm64&distro=debian-12.15&epoch=1"
          }
        }
      ],
      "status": "not_affected",
      "justification": "vulnerable_code_not_present",
      "impact_statement": "Limited to linux/arm64 ghcr.io/secpal/api@sha256:9ad840d7a2e2d919b91d250a71246707563035158213b6c8cec23492a2ddabb7, source SecPal/api@66a22aa331c37a948c218533b532cf54b1571270, publisher 40241417030 attempt 1, index sha256:d4d04a0b063f5ef772bec3e84b919f131c7a93f79f2bcf2aedb293980e874cb8. Debian zlib1g 1:1.2.13.dfsg-1 does not build or package contrib/minizip/zip.c. The actual libz.so.1.2.13 SHA-256 ffb1ab496e6eced03ab679075f9f2c415c7728a145cc7f63d614497102d73822 is byte-identical to the architecture-specific package authenticated through signed Debian indexes; the build boundary and ELF identity were independently checked, with separate MiniZip symbol-positive controls. The maintainer adopted the separate read-only technical assessment at https://github.com/SecPal/.github/issues/1268#issuecomment-6412327433 and approved validity only until 2026-11-25T00:00:00Z at https://github.com/SecPal/.github/issues/1268#issuecomment-6412825395. Technical outcome provenance: https://github.com/SecPal/.github/issues/1268#issuecomment-6412073717; the original separate review task locator is unknown and no different reviewer identity is claimed. Reviewed binary/source audit: https://github.com/SecPal/.github/blob/b2b4e3e9299e44b1e4f9593369a713252474f301/docs/audits/api-zlib-applicability-2026-10-26.md. No other component, version, OCI subject, vulnerability, risk acceptance or release/enrollment authority is covered."
    }
  ]
}
