{
  "@context": "https://openvex.dev/ns/v0.2.0",
  "@id": "https://openvex.dev/docs/secpal/fixture-1",
  "author": "SecPal Security <security@secpal.app>",
  "timestamp": "2026-08-20T00:00:00Z",
  "version": 1,
  "statements": [
    {
      "vulnerability": {
        "name": "GHSA-test-0001",
        "aliases": ["CVE-2026-0001"]
      },
      "products": [
        {
          "@id": "pkg:deb/debian/openssl@1.2.3",
          "identifiers": { "purl": "pkg:deb/debian/openssl@1.2.3" }
        }
      ],
      "status": "not_affected",
      "justification": "vulnerable_code_not_present"
    }
  ]
}
